{
  "$schema": "https://json-schema.org/draft/2020-12/schema",
  "$id": "https://github.com/CHIZI-0618/sing-box-inbound-bench/schema/config.schema.json",
  "title": "sing-box inbound benchmark configuration",
  "type": "object",
  "additionalProperties": false,
  "required": ["protocol_version", "run_id", "subject", "workload", "execution"],
  "properties": {
    "protocol_version": { "const": "inbound-bench/v3" },
    "run_id": { "type": "string", "pattern": "^[A-Za-z0-9][A-Za-z0-9._-]{0,63}$" },
    "subject": {
      "type": "object",
      "additionalProperties": false,
      "required": ["kind"],
      "properties": {
        "kind": { "enum": ["raw", "direct", "redirect", "tproxy", "tun", "tun-auto-redirect", "ebpf-tc", "ebpf-cgroup"] },
        "sing_box_binary": { "type": "string" },
        "listen": { "type": "string" },
        "target": { "type": "string" },
        "outbound_interface": { "type": "string" },
        "cgroup_path": { "type": "string", "pattern": "^/sys/fs/cgroup/.+" },
        "include_uid": { "type": "array", "minItems": 1, "items": { "type": "integer", "minimum": 0, "maximum": 4294967295 } },
        "api_listen": { "type": "string" },
        "api_token": { "type": "string" },
        "extra_arguments": { "type": "array", "items": { "type": "string" } },
        "tun_name": { "type": "string", "minLength": 1, "maxLength": 15, "pattern": "^[^/\\\\]+$" },
        "tun_address": { "type": "array", "minItems": 1, "items": { "type": "string" } },
        "mtu": { "type": "integer", "minimum": 1280, "maximum": 65535 },
        "firewall_binary": { "type": "string" },
        "ip_binary": { "type": "string" },
        "mark": { "type": "integer", "minimum": 1, "maximum": 4294967295 },
        "route_table": { "type": "integer", "minimum": 1 },
        "rule_priority": { "type": "integer", "minimum": 1 }
      },
      "allOf": [
        {
          "if": { "properties": { "kind": { "const": "direct" } }, "required": ["kind"] },
          "then": { "required": ["sing_box_binary", "listen", "target"] }
        },
        {
          "if": { "properties": { "kind": { "enum": ["ebpf-tc", "ebpf-cgroup"] } }, "required": ["kind"] },
          "then": { "required": ["sing_box_binary", "include_uid", "api_listen", "api_token"] }
        },
        {
          "if": { "properties": { "kind": { "const": "ebpf-cgroup" } }, "required": ["kind"] },
          "then": { "required": ["cgroup_path"] }
        },
        {
          "if": { "properties": { "kind": { "enum": ["redirect", "tproxy"] } }, "required": ["kind"] },
          "then": { "required": ["sing_box_binary", "listen"] }
        },
        {
          "if": { "properties": { "kind": { "enum": ["tun", "tun-auto-redirect"] } }, "required": ["kind"] },
          "then": { "required": ["sing_box_binary", "tun_address"] }
        }
      ]
    },
    "workload": {
      "type": "object",
      "additionalProperties": false,
      "required": ["protocol", "mode", "target", "payload_bytes"],
      "properties": {
        "protocol": { "enum": ["tcp", "udp"] },
        "mode": { "enum": ["echo", "bulk-upload", "bulk-download", "short", "idle", "pps", "standby"] },
        "target": { "type": "string" },
        "payload_bytes": { "type": "integer", "minimum": 1, "maximum": 1048576 },
        "requests": { "type": "integer", "minimum": 0 },
        "duration_ms": { "type": "integer", "minimum": 0 },
        "connections": { "type": "integer", "minimum": 1 },
        "flows": { "type": "integer", "minimum": 1 },
        "offered_pps": { "type": "integer", "minimum": 0, "maximum": 1000000000 },
        "udp_socket_mode": { "enum": ["connected", "unconnected"] },
        "timeout_ms": { "type": "integer", "minimum": 1 }
      },
      "allOf": [
        {
          "oneOf": [
            { "required": ["requests"], "not": { "required": ["duration_ms"] }, "properties": { "requests": { "minimum": 1 } } },
            { "required": ["duration_ms"], "not": { "required": ["requests"] }, "properties": { "duration_ms": { "minimum": 1 } } }
          ]
        },
        {
          "if": { "properties": { "protocol": { "const": "tcp" } }, "required": ["protocol"] },
          "then": { "properties": { "mode": { "enum": ["echo", "bulk-upload", "bulk-download", "short", "idle", "standby"] } } }
        },
        {
          "if": { "properties": { "protocol": { "const": "udp" } }, "required": ["protocol"] },
          "then": { "properties": { "mode": { "enum": ["echo", "pps"] }, "udp_socket_mode": { "enum": ["connected", "unconnected"] } } }
        },
        {
          "if": { "properties": { "protocol": { "const": "tcp" } }, "required": ["protocol"] },
          "then": { "not": { "required": ["udp_socket_mode"] } }
        },
        {
          "if": { "properties": { "mode": { "const": "pps" } }, "required": ["mode"] },
          "then": { "required": ["offered_pps"], "properties": { "offered_pps": { "type": "integer", "minimum": 1, "maximum": 1000000000 } } }
        },
        {
          "if": { "properties": { "mode": { "not": { "const": "pps" } } }, "required": ["mode"] },
          "then": { "properties": { "offered_pps": { "const": 0 } } }
        }
      ]
    },
    "execution": {
      "type": "object",
      "additionalProperties": false,
      "required": ["repetitions", "output_directory"],
      "properties": {
        "warmup_repetitions": { "type": "integer", "minimum": 0 },
        "repetitions": { "type": "integer", "minimum": 1 },
        "output_directory": { "type": "string", "minLength": 1 },
        "temporary_directory": { "type": "string" },
        "startup_timeout_ms": { "type": "integer", "minimum": 1 },
        "worker_uid": { "type": "integer", "minimum": 0, "maximum": 4294967295 }
      }
    }
  },
  "allOf": [
    {
      "if": {
        "properties": {
          "subject": {
            "properties": { "kind": { "enum": ["redirect", "tproxy", "tun", "tun-auto-redirect", "ebpf-tc", "ebpf-cgroup"] } },
            "required": ["kind"]
          }
        },
        "required": ["subject"]
      },
      "then": { "properties": { "execution": { "required": ["worker_uid"] } } }
    }
  ]
}
